Business name,Address,Phone Number,Rating,Url,Review
Entheos Printing Press,"220D East 8th Avenue, 108, Caloocan City 1403 Metro Manila",+63(02)83645344,5.0  (16),https://www.yellow-pages.ph/business/entheos-printing-press/reviews,"Gave us reasonable quotation price for our business forms which we gladly accept, more power po sa Entheos"
New Wintex Fabrics,"Unit S, Facilities Center, 548, Shaw Boulevard, Highway Hills, Mandaluyong City 1550 Metro Manila",+63(02)85311208,5.0  (8),https://www.yellow-pages.ph/business/new-wintex-fabrics-corporation/reviews,Huge selection of curtains and other fabric materials. Quality products! Look nowhere else!
Hua Seng Canvas & Plastic Corp,"662, Sabino Padilla Street, Binondo, City of Manila 1006  Metro Manila",+63(2)82420060,5.0  (8),https://www.yellow-pages.ph/business/hua-seng-canvas-plastic-corp/reviews,Thanks For offering me great prices for my canvas
Success Mirror City,"204, Antonio Arnaiz Avenue, Pasay City 1300  Metro Manila",+63(2)88315286,5.0  (7),https://www.yellow-pages.ph/business/success-mirror-city/reviews,"Once again, I installed 4 new mirrors from my favorite mirror company. Great workmanship as usual. Reasonable prices. Highly recommended."
Epp Fire Safety And Rescue Products,"4/F, Concord Building, 2584, A. Bonifacio Street, Bangkal, Makati City 1233  Metro Manila",+63(2)88440599,5.0  (7),https://www.yellow-pages.ph/business/epp-fire-safety-and-rescue-products/reviews,This business deserves 5 star review. 
Sherton Industrial,"38 A&B, General Tinio Street, Morning Breeze Subdivision, Caloocan City, Metro Manila",+63(2)83615975,5.0  (6),https://www.yellow-pages.ph/business/sherton-industrial-corporation/reviews,The people are nice and they have nice and affordable beds. Napaka accommodating ng team nila sa main office. =)
S.L. Development Construction,"2/F, Rusland Building, 1932, F. Agoncillo Street, Malate, City of Manila 1004 Metro Manila",+63(02)83531901,5.0  (6),https://www.yellow-pages.ph/business/sl-development-construction-corporation/reviews,The staff was very accommodating!
Puma Spring & Rubber,"141-B, San Rafael Extension, Mandaluyong City 1550  Metro Manila",+63(2)85346951,5.0  (6),https://www.yellow-pages.ph/business/puma-spring-rubber-corporation/reviews,"I am more than pleased to be able to give this recommendation to any potential customers, acknowledging PUMA SPRING & RUBBER CORP. to be one of the ???top??? suppliers we have worked with. The prices and lead times are terrific and when we have start up ideas, you work with us and our budget to get the specifics correct. 2 Thumbs up!"
Quantum,"No. 117, Tirad Pass Street, Bagong Barrio, Caloocan City 1400  Metro Manila",+63(2)83634077,5.0  (5),https://www.yellow-pages.ph/business/quantum-electronics-corporation/reviews,"quality products, approachable staffs, they really attend to what their customers need."
Nova Business Systems,"557 Nueve de Febrero, Barangay Pleasant Hills, Mandaluyong City, Metro Manila",+63(2)85326682,5.0  (5),https://www.yellow-pages.ph/business/nova-business-systems-incorporated-1/reviews,"Nova Business is our company's reliable supplier of business checks, we've been their client for years now. In printing business forms. Nova Business Systems, Inc. is indeed a MUST TRY! :)"
Mannasoft Technology,"2/F, Republic Glass Building, 196 Salcedo Street, Legaspi Village, Makati City 1229 Metro Manila",+63(2)88134162,5.0  (5),https://www.yellow-pages.ph/business/mannasoft-technology-corporation/reviews,There's been a lot of incidences of burglary in our area and we really wanted to make our home more secure. The digilock provided by Mannasoft Technology Corporation. It works really well and is pretty easy to understand and operate.
Solid Business Machines Center,"Singson Building,  Plaza Moraga, Binondo, City of Manila 1006 Metro Manila",+63(2)82421366,5.0  (5),https://www.yellow-pages.ph/business/solid-business-machines-center-incorporated/reviews,very accommodating staff they suggest what you really need
Super Miler Sales,"90,  P. Tuazon Boulevard corner Planas III, Cubao, Quezon City 1109 Metro Manila",+63(2)86542767,5.0  (4),https://www.yellow-pages.ph/business/super-miler-sales-corporation-2/reviews,Got the tires for my Mazda 3 here. The people at Super Miler know cars and are patient in explaining to clueless girls like me :)
LLumar Window Film,"2/F, 150, Bayani Street near G. Araneta Avenue, Barangay Dona Imelda, Quezon City 1113  Metro Manila",+63(02)84006357,5.0  (4),https://www.yellow-pages.ph/business/llumar-window-film-1/reviews,excellent quality... very great.
V-Tech Barcode Systems,"Unit 205, 2/F, The Tower At Emerald Square, J.P. Rizal Street corner P. Tuazon, Project 4, Milagrosa, Quezon City 1109  Metro Manila",+63(02)89127250,5.0  (4),https://www.yellow-pages.ph/business/v-tech-barcode-systems-philippines-incorporated/reviews,"Good day Sir/Mam. Interesado po kami bumili ng barcode scanner para po sa library system namin. Im an OJT from STI College - Lipa Campus. Please paki-contact po ako. Name: Rhobin Lising Mobile: 0905-1389-791; 0907-2244-416 Address: Lipa City, Batangas Purpose: Gagawa po kami ng library system with barcode technology para sa OJT company namin na Saint Francis de Sales Thelogical Seminary. Thank you po."
Excelsior Tours And Transport,"Unit 103, Canary Luxureville Condominium, Matthew Street, Multinational Village, Paranaque City 1708  Metro Manila",+63(2)88468428,5.0  (4),https://www.yellow-pages.ph/business/excelsior-tours-and-transport-corporation/reviews,perfect for travel and tour get aways plus offers affordable prices
Rey-D Enterprise,"Calendola Village, Nueve De Pebrero corner Shaw Boulevard, Addition Hills, Mandaluyong City, Metro Manila",+63(2)5325092,5.0  (4),https://www.yellow-pages.ph/business/rey-d-enterprise-inc/reviews, 
Braza Marketing,"G/F, Alcal Building (Ateneo near Mcdo), 285-A, Katipunan Avenue, Loyola Heights, Quezon City 1108  Metro Manila",+63(2)84264899,5.0  (4),https://www.yellow-pages.ph/business/braza-marketing-2/reviews,"We buy Motolite batteries for our company vehicles only from Braza Marketing. We trust them in keeping our vehicles in top condition, from supplying our auto parts requirements to their excellent car wash services."
Wescor Transformer,"10, Tikling Street, Vililia Village, Barangay Talipapa Novaliches, Quezon City, Metro Manila",+63(2)89306983,5.0  (4),https://www.yellow-pages.ph/business/wescor-transformer-corp/reviews,"Truly the number 1 transformer manufacturers in the country, winning almost all of the bidding in different places in the Philippines. They will give you the best value for your money."
Data Computer Forms,"86, Domingo M. Guevara Street, Mandaluyong City 1550 Metro Manila",+63(2)85310375,5.0  (4),https://www.yellow-pages.ph/business/data-computer-forms-incorporated/reviews,"Efficient Service, Competitive price !"
Victor Dy - The Feng Shui Master,"2655 Mercedes Street, Malate, City of Manila 1004 Metro Manila",+63(2)84006430,5.0  (4),https://www.yellow-pages.ph/business/new-world-consultants-inc/reviews,"Interesting book ""Feng Shui for Everybody""."
E-Wha Foam Philippines,"Lot 3 Plan PSU-222646, Cadena de Amor St., Brgy. San Miguel, Taguig City 1630 Metro Manila",+63(2)88861501,5.0  (3),https://www.yellow-pages.ph/business/e-wha-foam-philippines-inc/reviews,affordable product compare with leading brand with same quality
Intercool Cooling Tower,"13, St. Mary Street, Paradise Village, Project 8, Quezon City 1106  Metro Manila",+63(2)89242797,5.0  (3),https://www.yellow-pages.ph/business/intercool-cooling-tower-incorporated-2/reviews,Their team is very reliable and coordination with them is smooth. =)
Supersonic,"No. 8, Dr. M. Laurel Drive, Fortunate Village, Gate IV Maysan, Valenzuela City 1440 Metro Manila",+63(2)82927015,5.0  (3),https://www.yellow-pages.ph/business/supersonic-multi-products-sales-incorporated/reviews,The staff are really friendly and accommodating when it comes to inquiries. The prices are really affordable too. Awesome people.
Micronphil Industrial Sales,"Unit 1 D, ACR Building, 6, Zabarte Avenue, Barangay Kaligayahan, Novaliches, Quezon City 1124  Metro Manila",+63(2)89612881,5.0  (3),https://www.yellow-pages.ph/business/micronphil-industrial-sales-company/reviews,A reputable and competitive company servicing the surface preparation industry with a complete range of quality products and equipments.
Js Wallmatrix Marketing,"203, N. Domingo corner H. Lozada Streets, San Juan City 1500 Metro Manila",+63(2)87260001,5.0  (3),https://www.yellow-pages.ph/business/js-wallmatrix-marketing/reviews,They really have a great taste of carpets and window blinds! See for yourselves guys and find a good match=)
International Spring Industries,"3, Liko St. corner Mariveles St., Highway Hills, Mandaluyong City 1550  Metro Manila",+63(2)85336499,5.0  (3),https://www.yellow-pages.ph/business/international-spring-industries/reviews,best quality ; best service
Hyco,"1195-1199, Jose Abad Santos Avenue, Tondo, City of Manila 1012  Metro Manila",+63(2)82533440,5.0  (3),https://www.yellow-pages.ph/business/hi-q-commercial-incorporated/reviews,Hi-Q and Hyco have a variety of flavorings and seasonings needed by any food companies and culinary schools. High-class and always available. The accommodating staff is also a plus!
"A. R.T. Belarmino & Company, Cpas","691 Area A Zabarte Road, Diamond Drive, Camarin, Caloocan City  Metro Manila",+63(2)84045965,5.0  (3),https://www.yellow-pages.ph/business/a-rt-belarmino-company-cpas/reviews, 
Multi-Forms,"13, Gregorio H. Del Pilar Street, Quezon City 1105 Metro Manila",+63(2)83762247,5.0  (3),https://www.yellow-pages.ph/business/multi-forms-corporation/reviews,"Multi Forms has been in the printing industry for centuries now, thus will only deliver quality service."
Basic Machinery & Acoustics,"Suite 103 Tower Ground, M.C.S. Tower Makati Cinema Square Complex, Chino Roces Avenue, Makati City 1231  Metro Manila",+63(2)88111572,5.0  (2),https://www.yellow-pages.ph/business/basic-machinery-acoustics/reviews,Quality products!
Doron Builders & Construction Supplies Limited Company,"Lot 8 Block 1, Jasmin Street, Sampaguita Subdivision, Camarin, Caloocan City 1400  Metro Manila",+63(2)89622882,5.0  (2),https://www.yellow-pages.ph/business/doron-builders-construction-supplies-limited-company/reviews, 
AC Harris Cable,"5, Pio del Pilar corner Magat Salamat Streets, Concepcion II, Marikina City 1800  Metro Manila",+63(02)89412969,5.0  (2),https://www.yellow-pages.ph/business/ac-harris-cable/reviews, 
En-Tire Car Care Centre,"44, N. Roxas corner Apo Street, Brgy Sta Teresita, Quezon City 1114 Metro Manila",+63(02)87321173,5.0  (2),https://www.yellow-pages.ph/business/en-tire-car-care-centre-inc/reviews,Good service! Fast and efficient!
Delta Star Power Engineering,"1613, Samuel Street, Jordan Plaines, Novaliches Proper, Quezon City 1123  Metro Manila",+63(2)89395431,5.0  (2),https://www.yellow-pages.ph/business/delta-star-power-manufacturing-corporation/reviews,Quality Transformer & Good after sale service
Stronghold Bolts & Nuts,"445E, EDSA, Pasay City 1300 Metro Manila",+63(2)8891220,5.0  (2),https://www.yellow-pages.ph/business/stronghold-bolts-nuts-corporation/reviews,A wide variety of bolts and nuts. Great Materials! 
Dominic Construction,"229-A, Basilan corner Talayan Streets, Mandaluyong City 1550  Metro Manila",+63(2)34702297,5.0  (2),https://www.yellow-pages.ph/business/dominic-construction-incorporated/reviews,have been in the contractors and builders industry for so long. they continuously give quality services to their clients. totally worth your money.
Thermotrol Electrical Sales And Services,"235-J, MacArthur Highway, Valenzuela City 1440  Metro Manila",+63(2)82915259,5.0  (2),https://www.yellow-pages.ph/business/thermotrol-electrical-sales-and-services/reviews, 
Liberty Corrugated Boxes Manufacturing,"40, Governor Pascual Avenue corner Atis Road, Potrero, Malabon City 1475  Metro Manila",+63(2)83612541,5.0  (2),https://www.yellow-pages.ph/business/liberty-corrugated-boxes-manufacturing-corporation/reviews,"Bikers, get in touch with them, they are currently in the process of producing a bike box. Highly recommended for bikers that need to transport their bikes. Very good alternative to expensive ones available in the market."
Golden Electrical And Machinery Corp.,"1270, C.M. Recto Avenue, City of Manila 1006  Metro Manila",+63(2)82446173,5.0  (2),https://www.yellow-pages.ph/business/golden-electrical-and-machinery-corp-2/reviews,complete and affordable machine tools and best dealer of electric motors. good repairing services.
RSL Pamatay Sunog Enterprises,"373 Unit 3, A. Bonifacio Avenue corner Mauban Street, Barangay San Jose, Quezon City 1100  Metro Manila",+63(2)87096118,5.0  (2),https://www.yellow-pages.ph/business/rsl-pamatay-sunog-enterprises/reviews,High quality products and staff are very accomodating. Their products are also affordable.
Lcsn Express Movers,"Block 18 Lot 17, 19 & 21, BF Martinville Subdivision, Barangay Manuyo Dos, Las Pinas City 1744  Metro Manila",+63(2)84018138,5.0  (2),https://www.yellow-pages.ph/business/lcsn-express-movers-incorporated/reviews,"Many Companies trust LCSN EXPRESS MOVERS, INC. for its Reliability and fast delivery of items. LCSN offers Land, via Air, and Water cargo delivery and even door-to-door delivery. For those who are looking for a safe and reliable freight mover, LCSN is a Must Try!!"
Integrated Rentals,"59, Robert corner Williams Streets, Barangay San Jose, Pasay City 1235  Metro Manila",+63(2)85501119,5.0  (2),https://www.yellow-pages.ph/business/integrated-rentals-inc/reviews,They have a very good fleet service for companies that do not want to worry about maintenance and capital expenditures. Cost effective. And their drivers are dependable and efficient.
Ceo Suite Manila,"37 / F, LKG Tower, 6801 Ayala Avenue, Makati City, Metro Manila",+63(906)4050419,5.0  (2),https://www.yellow-pages.ph/business/ceo-suite-philippine-branch/reviews,Excellent serviced and assistance to clients need.
Standard Overseas Business,"44, San Antonio Street, Barangay San Antonio, Quezon City 1100  Metro Manila",+63(2)8374164,5.0  (2),https://www.yellow-pages.ph/business/standard-overseas-business-corporation/reviews, 
Tanlimco Brothers,"313, Escolta corner Yuchengo Streets, Binondo, City of Manila 1000 Metro Manila",+63(02)82412863,5.0  (1),https://www.yellow-pages.ph/business/tanlimco-brothers-incorporated/reviews,one of the pioneer in sewing machines business and much cheaper in service and products.
Switch Sales International,"1384, Araneta Avenue, Quezon City 1100 Metro Manila",+63(02)8732370,5.0  (1),https://www.yellow-pages.ph/business/switch-sales-international/reviews, 
Polygenesis Commercial,"Unit 1 G/F, One Binondo Place, 567, San Nicolas corner Ilang-ilang Streets, City of Manila 1006  Metro Manila",+63(2)82423296,5.0  (1),https://www.yellow-pages.ph/business/polygenesis-commercial/reviews, 
Japan Parts Trading Center,"1273, C. M. Recto Avenue, City of Manila 1000  Metro Manila",+63(2)82557777,5.0  (1),https://www.yellow-pages.ph/business/japan-parts-trading-center/reviews,Has a variety and high-quality bearings. Both for Industrial and Automotive bearings. Always on-the-go to serve you!
International Stainless Products Manufacturing,"21, MGM Industrial Compound, Sitio Gitna Road, Bo. Kaybiga, Caloocan City 1400  Metro Manila",+63(2)89373737,5.0  (1),https://www.yellow-pages.ph/business/international-stainless-products-manufacturing-corporation/reviews,Offers affordable yet high-quality stainless steel water storage tanks for all.
Everbright Net And Twine Manufacturing,"Edison Avenue, Paranaque City 1700  Metro Manila",+63(02)88241619,5.0  (1),https://www.yellow-pages.ph/business/everbright-net-and-twine-manufacturing-corporation/reviews, 
Condesa Stationery,"G/F, Wellington Building, 611, Norberto Ty Street, Binondo, City of Manila 1006  Metro Manila",+63(2)82433512,5.0  (1),https://www.yellow-pages.ph/business/condesa-stationery-incorporated/reviews,Has all office and school supplies you need. You'll find anything and everything in here.
Philippine Bed And Furniture Manufacturing,"27 G. Molina Street, Canumay East, Valenzuela City, Metro Manila",+63(632)2776582,5.0  (1),https://www.yellow-pages.ph/business/philippine-bed-and-furniture-manufacturing-corporation-3/reviews,Quality mattresses at affordable prices. check out their year end sale!
Versatemp,"162, Mabini Street,  Addition Hills, San Juan City 1556 Metro Manila",+63(2)87269246,5.0  (1),https://www.yellow-pages.ph/business/versatemp-corporation/reviews, 
Danitech Power System,"Block 11 Lot 15-A, Talisay Street, Amparo Subdivision, North, Caloocan City 1425  Metro Manila",+63(2)89628239,5.0  (1),https://www.yellow-pages.ph/business/danitech-power-system-incorporated/reviews,"If you're thinking of putting in the electrical system of your newly constructed home, Danitech Power System is NOT the right contractor since they are the powerhouse in electrical and power systems, they handle high voltage facilities, transformers  and power generating plants to mention a few, they also have a 24/7 emergency response system. A  high level of service quality is a must for public-related services offered by Danitech. We also tried their products in our office."
Md Laquindanum Trucking,"68, Road 18 Extension, San Jose Village, Project 8, Quezon City 1106  Metro Manila",+63(02)89206784,5.0  (1),https://www.yellow-pages.ph/business/md-laquindanum-trucking-incorporated/reviews,"Good service provider!!! reasonable price, Mabilis kausap!!!!"
Ivm Enterprises And Development,"3/F, RCDC Building, 154, Roosevelt Avenue, Barangay Paraiso, Quezon City 1100 Metro Manila",+63(2)83717571,5.0  (1),https://www.yellow-pages.ph/business/ivm-entreprises-devt-corp/reviews,High quality products at very affordable prices. Accomodating staff as well!
"Toprite Plastic Industries, Inc.","292, E. Miranda Street, Paso De Blas, Valenzuela City 1208 Metro Manila",+63(2)82942804,5.0  (1),https://www.yellow-pages.ph/business/toprite-plastic-industries-inc/reviews,two thumbs up for best quality of products :)
Oberly And Company,"17, Labo Street, Barangay San Isidro, Quezon City 1113 Metro Manila",+63(2)87401595,5.0  (1),https://www.yellow-pages.ph/business/oberly-and-company-incorporated/reviews,Very useful and good quality. Highly Recommended.
Hiyas Press,"Abiva Building, 851, G. Araneta Avenue, Quezon City 1113  Metro Manila",+63(2)87406589,5.0  (1),https://www.yellow-pages.ph/business/hiyas-press-inc-3/reviews,"These guys are great! They do great work (I have used them for postcards) and are reasonably priced, plus they are great with responding to the thousands of questions I ask about everything. Super professional and cool."
Ab Solis Trucking,"25, 11th Street corner 12 Street, Damayang Lagi, New Manila, Quezon City 1550  Metro Manila",+63(2)86377362,5.0  (1),https://www.yellow-pages.ph/business/ab-solis-trucking/reviews, 
Willshine Enterprise Company,"Unit 2B, 1, Kay Talise Street corner Sison Road, Barangay San Dionisio, Paranaque City 1700  Metro Manila",+63(2)77535501,5.0  (1),https://www.yellow-pages.ph/business/willshine-enterprise-company-2/reviews,BUY AND SELL RUBBER FUEL OIL
Fulton Industrial Supply Enterprises Philippines,"1233, Benavidez Street, Sta. Cruz, City of Manila 1003  Metro Manila",+63(2)82548739,5.0  (1),https://www.yellow-pages.ph/business/fulton-industrial-supply-enterprises-philippines-incorporated/reviews,good quality of sewing machines. much cheaper than any store. free estimate.
Nanding's Steel Beds,"1643, Crisostomo corner Makiling Streets, Sampaloc, City of Manila 1015  Metro Manila",+63(02)87415230,5.0  (1),https://www.yellow-pages.ph/business/nanding-s-steel-beds/reviews,High quality beds for your home and rentals. Very friendly staff as well. :)
Caloocan Oil Seal,"Unit 78, Gracepark Commercial Complex, 4th Avenue, Caloocan City 1403  Metro Manila",+63(2)83659366,5.0  (1),https://www.yellow-pages.ph/business/caloocan-oil-seal-corporation/reviews,"A sister company of Manila Oil Seal, Caloocan Oil Seal promises to offer the same quality products."
Tiffany Stained Glass & Aluminum Company,"Unit 6 G/F, San Diego Fishery Building, 462, Carlos Palanca Street, Quiapo, City of Manila 1001  Metro Manila",+63(02)84016714,5.0  (1),https://www.yellow-pages.ph/business/tiffany-stained-glass-and-aluminum-company-incorporated/reviews, 
Mass V Group,"3/F, MVGI Building, 34, Congressional Avenue, Project 8, Quezon City 1106  Metro Manila",+63(2)34547355,5.0  (1),https://www.yellow-pages.ph/business/mass-v-group-incorporated/reviews,Trusted in the business. Reliable. Quality at its best. That's MASS V GROUP- Automotive Batteries that keep you going.
Geotesting International,"5550-B, Boyle Street, Palanan, Makati City 1235  Metro Manila",+63(2)88331611,5.0  (1),https://www.yellow-pages.ph/business/geotesting-international-inc/reviews,reliable service for soil testing! call them now.
Cortransport,"9, Marian Road II, East Service Road, Barangay San Martin De Porres, Paranaque City, Metro Manila",+63(2)88089181,5.0  (1),https://www.yellow-pages.ph/business/cortransport-corporation/reviews,Their services are very good. The staff was very accommodating and all of our transactions went smoothly.
Century Precision Scale Manufacturing,"15, Tuazon Avenue corner Nangka Road, Potrero, Malabon City 1475  Metro Manila",+63(02)83613979,5.0  (1),https://www.yellow-pages.ph/business/precision-scale-manufacturing/reviews,Great customer service!
Letech Manufacturing,"6-A, Mariano Ponce Street, Caloocan City, Metro Manila",+63(02)83642762,5.0  (1),https://www.yellow-pages.ph/business/letech-manufacturing-corporation/reviews,Wide Variety and high quality plastic products and very affordable.
Crl Environmental,"Unit 609, Cityland 10 Tower 1, H.V. Dela Costa Street corner Ayala Avenue, Makati City 1200  Metro Manila",+63(2)88133726,5.0  (1),https://www.yellow-pages.ph/business/crl-environmental-corporation/reviews, 
Bearing Kingdom Industrial Equipment Trading,"1144, C.M. Recto Avenue, Binondo, City of Manila 1006  Metro Manila",+63(2)82549086,5.0  (1),https://www.yellow-pages.ph/business/bearing-kingdom-industrial-equipment-trading/reviews,"If your looking for quality bearings, Bearing Kingdom isthe perfect store for all your Bearing needs!"
Techglobal,"506, Ilang-Ilang Street, Barangay 281 Zone 26, San Nicolas, City of Manila 1010 Metro Manila",+63()9988757,5.0  (1),https://www.yellow-pages.ph/business/techglobal-incorporated/reviews,I am very satisfied with the water quality and supply in my new condo unit at the Beacon Residence. The high-quality eco-friendly and non-toxic water system installation is provided by Techglobal Incorporated.
Gl Manila,"Unit 2014, 20/F, Medical Plaza Makati Condo,  Amorsolo corner Dela Rosa Streets, Legaspi Village, Makati City 1229 Metro Manila",+63(2)85551418,5.0  (1),https://www.yellow-pages.ph/business/gl-inc-accounting-services-cooperative/reviews,Their accounting services was great.. Thumbs Up for you guys.
Sas Smart Account Solution,"32 C, Cityland Condominium 8, 98 Sen Gil Puyat Avenue, Makati City 1200 Metro Manila",+63(2)75013248,5.0  (1),https://www.yellow-pages.ph/business/sas-smart-account-soultion-co-ltd/reviews,"SAS - Solution Leader in Accounting services, Bookkeeping, Auditing, Outsourcing & Tax consultancy"
Esquire Financing,"31st Floor Penthouse, High Street South Corporate Plaza Tower 1, 26th Street, BGC, Fort Bonifacio, Taguig City 1634 Metro Manila",+63(02)88118888,5.0  (1),https://www.yellow-pages.ph/business/esquire-financing-incorporated/reviews, They have been very responsive and helpful whenever we have questions or need assistance. good job! :)
Aceg Steel,"34, Facilities Centre Building, Shaw Boulevard, Mandaluyong City 1550 Metro Manila",+63(2)85311236,5.0  (1),https://www.yellow-pages.ph/business/aceg-steel-products-incorporated/reviews,They have all kinds of insulating material
Pricewaterhousecoopers Consulting,"29th Floor, Philamlife Tower, 8767 Paseo de Roxas, Makati City, Metro Manila",+63(2)88452728,5.0  (1),https://www.yellow-pages.ph/business/pricewaterhousecoopers-financial-advisors-inc/reviews,Friendly and Approachable Staff! 
Adams Technical Supply,"708, Victoria Avenue Corner Escuella Street, Intramuros, City of Manila 1000 Metro Manila",+63(02)85275165,5.0  (1),https://www.yellow-pages.ph/business/adams-technical-supply/reviews,"Adams sells a wide variety of school supplies especially engineering materials at a very low price. Located inside Intramuros, near  Manila Highschool."
Proaccess Business Services,"1100, 88 Corporate Center,  Sedeno corner Valero Streets, Salcedo Village, Makati City 1227 Metro Manila",+63(2)79082500,5.0  (1),https://www.yellow-pages.ph/business/proaccess-business-services-incorporated-2/reviews,"I worked in a call center for a long time and I am convinced that the office space of each agent is important for them to perform well in their tasks. The office I am working at got its partitions and desks from PROACCESS BUSINESS SERVICES, INC. The partitions look good and and are durable, plus, the phones ca be strategically placed on the tables. It is spacious enough to accommodate a desktop."
Active Business Solutions,"5/F, Lepanto Building, 8747 Paseo De Roxas, Makati City 1226 Metro Manila",+63(2)88931111,5.0  (1),https://www.yellow-pages.ph/business/active-business-solutions-inc/reviews,Services are reliable and fast!
DPC,"15/F, DPC Place Building, 2322, Chino Roces Avenue Extension, Makati City 0788 Metro Manila",+63(2)85558570 loc. 8790,4.8  (25),https://www.yellow-pages.ph/business/dpc-3/reviews,"I'm really attracted to use their app, it's really amazing. It allows me to find the businesses that I want to see. Two thumbs up "
