Business name,Address,Phone Number,Rating,Url,Review
Cost U Less Furniture & Interior Solutions,"5112, Filmore corner Curie Streets, Palanan, Makati City 1235 Metro Manila",+63(2)88326360,4.7  (7),https://www.yellow-pages.ph/business/cost-u-less-trade-ventures-2/reviews,"It's like the Ensogo for furnitures, you'll find discount after discount on all furnitures for your home, offices or your resto. So if you're planning that renovation or refurbishment for your home, Cost U Less offers their services to ensure your budget is met yet quality is not compromised."
Almadeco,"Almadeco Building, 75, Clemente Jose Street, Malibay, Pasay City 1300  Metro Manila",+63(2)88519848,4.5  (4),https://www.yellow-pages.ph/business/alfaj-marketing-development-corporation/reviews,:)
Teleperformance Philippines,"14/F, Octagon Building,  San Miguel Avenue, Pasig City, Metro Manila",+63(2)85560007,4.3  (11),https://www.yellow-pages.ph/business/teleperformance-philippines/reviews,"Feb 13, 2023 One of your recruits called me  (09209770308) for an initial interview and he offered me the ""NON-VOICE Financial Account"" so I said yes the interview went well and it ends that I will be receiving a call for the final interview."
Sambon Industrial Sales,"C.M. Recto Avenue, 1143, Gocheco Building, City of Manila, Metro Manila",+63(2)82549061,4.3  (6),https://www.yellow-pages.ph/business/sambon-industrial-sales-incorporated/reviews,This company is recommended! They give good quality and good service. 
Tierodman Auto Center,"246, P. Ocampo Extension corner Sampaloc Street, Barangay San Antonio, Makati City 1203  Metro Manila",+63(2)88992773,4.3  (3),https://www.yellow-pages.ph/business/tierodman-auto-center/reviews,Good day maam/sir. Meron po kayong transmission ng canter 4d36? 5 speed. tnx.
Certified Pest Control Services,"146-C, 3rd Street between 10th and 11th Avenue, Grace Park, Barangay 91, Caloocan City 1403  Metro Manila",+63(02)83611971,4.0  (6),https://www.yellow-pages.ph/business/certified-pest-control-services/reviews,how long para mapatay mga ipis? buhay pa din
Jt Max Power Equipment,"303, Verde Oro Building, 535, Commonwealth Avenue, Barangay Matandang Balara, Quezon City 1119  Metro Manila",+63(2)77455630,4.0  (4),https://www.yellow-pages.ph/business/jtmax-power-equipment-corporation/reviews,Their staff are very nice and friendly also the service was great and Good quality. Highly recommend it! 
Sanlex,"34, C-3 Road corner Dagat-dagatan Avenue, Caloocan City, Metro Manila",+63(02)82875495,4.0  (3),https://www.yellow-pages.ph/business/sanlex-roofmaster-center-company-incorporated/reviews,"Sanlex roof paint so thin, not good. Wala primer paint madaling matagal ang paint coating. Compare sa iba brand makapit ang paint ng iba brand, . Need ko pa mag re-paint after installation dahil ng mabasa ng ulan nag appear agad ang kalawang. Very dissapointed ako."
Standard Plastics,"Jojo Street, Baesa, Quezon City 1106  Metro Manila",+63(02)34557322,4.0  (1),https://www.yellow-pages.ph/business/standard-plastics-corporation/reviews, 
Sgp Junk Shop & General Merchandise,"Dr. Jose Fabella Road, NCMH Compound, Purok 3, Barangay Mauway, Mandaluyong City 1552  Metro Manila",+63(02)85355891,4.0  (1),https://www.yellow-pages.ph/business/sgp-junk-shop-general-merchandise/reviews, 
Man Great Security Agency,"JCL Building, 8206, Dr. A. Santos Avenue, San Isidro, Paranaque City 1700  Metro Manila",+63(02)88260410,4.0  (1),https://www.yellow-pages.ph/business/man-great-security-agency-corporation/reviews, 
Aqua-Pump Industrial,"52, P. Cruz Street, Old Zaniga, Mandaluyong City 1550  Metro Manila",+63(2)85351572,4.0  (1),https://www.yellow-pages.ph/business/aqua-pump-industrial-corporation/reviews, 
Golden Award Design And Trade,"18-B, Dagot Street, Manresa, Quezon City 1115  Metro Manila",+63(2)88781314,4.0  (1),https://www.yellow-pages.ph/business/golden-award-design-and-trade-corporation/reviews, 
Air-Rich Industrial Systems,"81, P. Sevilla Street corner 4th Avenue, Grace Park, Caloocan City 1400  Metro Manila",+63(2)83620596,4.0  (1),https://www.yellow-pages.ph/business/air-rich-industrial-systems-inc/reviews, 
Ace Cor Ambulance Service,"756, Instruccion Street, Sampaloc, City of Manila 1015  Metro Manila",+63(2)87495476,3.0  (2),https://www.yellow-pages.ph/business/ace-cor-ambulance-service/reviews, 
Orange Translations,"37/F, LKG Tower, 6801 Ayala Avenue, Makati City 1226 Metro Manila",+63(2)88360854,3.0  (2),https://www.yellow-pages.ph/business/orange-translations/reviews,Very Rude Management!!
Circulated Electrical & Industrial Supply,"8191, Dr. A. Santos Avenue, Sucat, Paranaque City, Metro Manila",+63(2)88205542,1.0  (1),https://www.yellow-pages.ph/business/circulated-electrical-industrial-supply/reviews,Sobrang mga bastos! Walang mga kwentang kausap sa phone regarding sa inquiries!
Peoplesupport,"12-14/F, Philamlife Tower, 8767 Ayala Avenue Corner Sen. Gil Puyat Avenue, Makati City, Metro Manila",+63(2)88858000,1.0  (1),https://www.yellow-pages.ph/business/peoplesupport-philippines-incorporated/reviews,2 thumbs down
